{
    "$schema": "https://json-schema.org/draft/2020-12/schema",
    "title": "Parsed Resume Schema",
    "type": "object",
    "properties": {
      "source_file": {"type": "string"},
      "name": {"type": "string"},
      "contacts": {
        "type": "object",
        "properties": {
          "email": {"type": "string"},
          "phone": {"type": "string"},
          "location": {"type": "string"}
        }
      },
      "education": {"type": "array", "items": {"type": "object"}},
      "experiences": {"type": "array", "items": {"type": "object"}},
      "skills": {"type": "array", "items": {"type": "string"}}
    },
    "required": ["name", "education", "experiences", "skills"]
  }
  
