{
  "source_file": "ee.pdf",
  "name": "Justine Debowski",
  "contacts": {
    "email": "justinedeb@email.com",
    "phone": "123) 456-7890",
    "location": ""
  },
  "education": [
    {
      "degree": "Bachelor",
      "institution": "College",
      "start": "2008",
      "end": "2012"
    }
  ],
  "experiences": [
    {
      "company": "",
      "role": "",
      "start": "2015",
      "end": "2019",
      "bullets": [
        "Pie Insurance",
        "Lead Insurance Data Analyst",
        "Denver, CO | 2019 - current",
        "Produced and delivered 100+ BI dashboards and reports",
        "Measured and demonstrated organizational efficiencies with data",
        "analysis and reporting",
        "Worked with 6 technical and business peers on development efforts,",
        "including designing, analyzing, assessing, and reporting",
        "Managed 100% of data management deliverables such as business need",
        "analysis and high-level data modeling techniques",
        "Identified, recommended, and implemented appropriate continuous",
        "improvement opportunities",
        "Argo Group",
        "Data Analyst",
        "Denver, CO | 2015 - 2019",
        "Identified, analyzed, and interpreted trends and patterns in 260+",
        "complex data sets",
        "Used statistical techniques to interpret data, analyze results and provide",
        "30+ ongoing reports",
        "Developed and implemented 3 new data collection systems and",
        "methodologies that optimized statistical efficiency and data quality",
        "Identified 8+ process gaps and worked cross-functionally to formulate",
        "data-driven improvement plans",
        "IMA Financial Group, Inc.",
        "Data Analyst",
        "Denver, CO | 2012 - 2015",
        "Performed 80+ data profiling activities to provide statistics and",
        "informative summaries for integration of new source system data",
        "Built out data dictionary with 320+ data definitions, values, and formats",
        "Created data collection mapping process for 3 systems, in collaboration",
        "with data stewards",
        "Investigated and documented data lineages throughout the data",
        "lifecycle",
        "Collaborated with 4 delivery teams in business, IT, data modeling, and",
        "data quality analytics to analyze market data"
      ]
    }
  ],
  "skills": [
    "Python; SQL; Adobe Analytics\n; STATA; Tableau; Excel;\nAzure; Visio; Numpy; Pandas;\nPowerBI; AWS"
  ]
}